name,url,stars,forks,language,owner,description,pushed_at,created_at,open_issues
yolo-ios-app,https://github.com/ultralytics/yolo-ios-app,231,42,Swift,ultralytics,Ultralytics YOLO iOS App source code for running YOLO in your own iOS apps 🌟,2025-03-21T05:56:22Z,2024-02-11T16:02:29Z,13
timer-live-activity,https://github.com/rgommezz/timer-live-activity,231,10,Swift,rgommezz,Seamless integration of iOS Live Activities into React Native with two-way communication 🎨,2024-03-07T02:06:02Z,2024-01-10T23:20:04Z,5
iMCP,https://github.com/loopwork-ai/iMCP,231,6,Swift,loopwork-ai,"A macOS app that provides an MCP server to your Messages, Contacts, and more",2025-03-21T19:15:42Z,2025-03-05T13:14:00Z,11
visionOS-Examples,https://github.com/jordibruin/visionOS-Examples,230,15,Swift,jordibruin,Examples of how to build things in VisionOS,2024-01-14T12:15:02Z,2023-07-28T14:08:32Z,2
metallurgy,https://github.com/raphaelsalaja/metallurgy,229,11,Swift,raphaelsalaja,"A SwiftUI repository, showcasing a meticulously curated assortment of Metal shaders strategically crafted to harness the innovative visual enhancements introduced in iOS 17.",2023-07-22T19:46:43Z,2023-06-24T10:47:17Z,0
StreamUI,https://github.com/StreamUI/StreamUI,228,4,Swift,StreamUI,"🎥 〜StreamUI: Make videos with SwiftUI (and even stream them to Youtube, Twitch, etc)",2024-07-03T01:20:35Z,2024-06-20T23:32:47Z,3
StartupFolder,https://github.com/FuzzyIdeas/StartupFolder,228,1,Swift,FuzzyIdeas,Run anything at startup by placing it in a special folder,2025-03-13T12:24:58Z,2025-01-25T20:45:06Z,0
Recap,https://github.com/mergesort/Recap,228,8,Swift,mergesort,"A What's New screen, and more",2024-11-25T19:24:10Z,2024-10-04T21:13:40Z,7
hll-wp-therouter-ios,https://github.com/HuolalaTech/hll-wp-therouter-ios,227,29,Swift,HuolalaTech,A framework for assisting in the renovation of iOS componentization,2025-01-10T03:31:53Z,2023-07-24T07:25:15Z,2
SMBClient,https://github.com/kishikawakatsumi/SMBClient,227,19,Swift,kishikawakatsumi,Swift SMB client library and iOS/macOS file browser applications.,2025-01-01T07:13:14Z,2024-07-16T05:37:24Z,0
IcySky,https://github.com/Dimillian/IcySky,226,11,Swift,Dimillian,A BlueSky Client. TBD.,2025-01-30T12:03:00Z,2024-11-16T09:07:43Z,2
SwiftOpenAI,https://github.com/SwiftBeta/SwiftOpenAI,226,23,Swift,SwiftBeta,OpenAI API build with Swift ❤️,2024-05-17T21:14:39Z,2023-03-18T20:42:15Z,9
SwiftUICoreImage,https://github.com/danwood/SwiftUICoreImage,226,10,Swift,danwood,Hundreds of Core Image filters wrapped as CIImage modifiers for easy integration with SwiftUI,2024-06-26T23:07:57Z,2023-05-16T21:32:38Z,1
There,https://github.com/dena-sohrabi/There,226,8,Swift,dena-sohrabi,Track timezones 🌍 ,2024-09-18T17:01:16Z,2024-09-02T08:06:52Z,6
ferrostar,https://github.com/stadiamaps/ferrostar,225,38,Swift,stadiamaps,A FOSS navigation SDK built from the ground up for the future,2025-03-18T14:56:05Z,2023-04-27T18:42:03Z,113
Sky.app,https://github.com/jcsalterego/Sky.app,225,10,Swift,jcsalterego,"Sky.app is a great way to use Bluesky Social on MacOS, featuring keyboard shortcuts, Dark Mode Sync, and notification badges.",2024-12-28T16:41:16Z,2023-04-26T13:57:14Z,7
swift-mmio,https://github.com/apple/swift-mmio,225,18,Swift,apple,Define and operate on type safe MMIO,2025-03-11T22:32:51Z,2023-09-12T22:36:32Z,13
Variablur,https://github.com/daprice/Variablur,224,3,Swift,daprice,"Variable blur effects for SwiftUI, powered by Metal",2023-12-08T21:17:59Z,2023-11-19T00:21:56Z,1
SpatialMediaKit,https://github.com/sturmen/SpatialMediaKit,223,19,Swift,sturmen,Create and split MV-HEVC video files on an Apple Silicon Mac.,2024-06-21T23:18:43Z,2024-01-21T19:40:08Z,6
unlost,https://github.com/Vincent-liuwingsang/unlost,222,5,Swift,Vincent-liuwingsang,,2024-03-06T17:49:58Z,2024-02-20T13:46:21Z,9
AmpFin,https://github.com/rasmuslos/AmpFin,220,23,Swift,rasmuslos,Native Jellyfin music player for iOS & iPadOS,2025-01-09T21:43:37Z,2023-09-06T00:41:52Z,24
layers,https://github.com/raphaelsalaja/layers,218,6,Swift,raphaelsalaja,"A powerful SwiftUI library designed for creating layered user interfaces, enhancing your app's user experience with smooth and performant animations between modal views.",2023-10-06T19:55:12Z,2023-09-30T21:43:22Z,8
Derootifier,https://github.com/haxi0/Derootifier,217,33,Swift,haxi0,"""Derootifies"" jailbreak .deb files to support Fugu15 Max otherwise known as Dopamine.",2024-01-10T13:50:29Z,2023-04-23T10:51:23Z,3
swift-testing-revolutionary,https://github.com/giginet/swift-testing-revolutionary,215,4,Swift,giginet,A tool converts test cases written in XCTest to swift-testing,2025-02-09T05:46:26Z,2024-05-03T09:03:55Z,4
OnboardingKit,https://github.com/JamesSedlacek/OnboardingKit,215,15,Swift,JamesSedlacek,SwiftUI library for handling onboarding,2025-03-11T00:40:39Z,2023-12-31T18:59:42Z,5
effort,https://github.com/kolinko/effort,215,9,Swift,kolinko,An implementation of bucketMul LLM inference,2024-07-01T09:52:31Z,2024-03-26T07:38:48Z,1
VerticalSplit,https://github.com/vedantgurav/VerticalSplit,214,13,Swift,vedantgurav,A SwiftUI container that presents two views stacked vertically with an adjustable split.,2024-03-06T20:34:37Z,2024-02-28T01:55:42Z,1
SGMExamples,https://github.com/ynagatomo/SGMExamples,214,13,Swift,ynagatomo,A collection of Shader Graph Materials for visionOS.,2024-07-13T09:54:37Z,2024-05-17T09:29:36Z,0
FindMySync,https://github.com/MartinPham/FindMySync,214,13,Swift,MartinPham,,2024-07-24T08:08:45Z,2023-01-15T21:05:48Z,17
Nominate,https://github.com/NSHipster/Nominate,214,5,Swift,NSHipster,macOS app for renaming PDFs based on their contents,2025-02-05T14:54:37Z,2024-10-07T16:39:52Z,2
DeepSeek,https://github.com/DargonLee/DeepSeek,213,43,Swift,DargonLee,DeepSeek iOS - 高效率的AI助手,2025-01-02T00:51:41Z,2024-12-31T09:20:04Z,4
XcodeSelectiveTesting,https://github.com/mikeger/XcodeSelectiveTesting,212,12,Swift,mikeger,Xcode selective testing: Run only tests relevant to the changeset.,2025-03-18T09:32:46Z,2023-03-02T22:26:28Z,8
SpeziLLM,https://github.com/StanfordSpezi/SpeziLLM,211,23,Swift,StanfordSpezi,Large Language Model (LLM) module for the Spezi Ecosystem,2025-03-19T18:50:10Z,2023-05-21T03:32:01Z,13
MagnificationLoupe,https://github.com/jtrivedi/MagnificationLoupe,211,6,Swift,jtrivedi,,2023-06-15T22:26:44Z,2023-06-15T21:44:23Z,0
ios-pass,https://github.com/protonpass/ios-pass,210,26,Swift,protonpass,iOS client for Proton Pass,2025-03-12T17:31:25Z,2023-06-20T08:52:20Z,0
DynamicNotchKit,https://github.com/MrKai77/DynamicNotchKit,210,16,Swift,MrKai77,Seamlessly adapt your macOS app to the notch era.,2024-11-21T23:00:29Z,2023-08-26T00:13:54Z,2
Apple-Music-UI-Demo,https://github.com/sebjvidal/Apple-Music-UI-Demo,209,18,Swift,sebjvidal,An Xcode project demonstrating how to recreate Apple Music's Now Playing view controller transition using Swift and UIKit.,2024-11-01T23:00:10Z,2024-05-04T14:30:32Z,0
Mesh-Transform-Animation,https://github.com/jtrivedi/Mesh-Transform-Animation,208,11,Swift,jtrivedi,,2023-12-30T20:36:53Z,2023-12-30T20:36:50Z,0
libtailscale,https://github.com/tailscale/libtailscale,207,23,Swift,tailscale,Tailscale C library,2025-03-07T14:33:12Z,2023-02-21T01:01:40Z,0
TurboNavigator,https://github.com/joemasilotti/TurboNavigator,207,15,Swift,joemasilotti,A drop-in class for Turbo Native apps to handle common navigation flows.,2024-10-10T20:22:54Z,2023-03-02T18:45:06Z,2
Customized-Aerial-Screen-Saver,https://github.com/FalconLee1011/Customized-Aerial-Screen-Saver,206,7,Swift,FalconLee1011,,2024-03-26T07:46:30Z,2023-10-08T01:57:34Z,6
swift-openapi-runtime,https://github.com/apple/swift-openapi-runtime,206,48,Swift,apple,API package for code generated by Swift OpenAPI Generator.,2025-03-13T10:36:18Z,2023-04-20T16:52:03Z,0
expo-stable-diffusion,https://github.com/andrei-zgirvaci/expo-stable-diffusion,203,4,Swift,andrei-zgirvaci,Run Stable Diffusion using Core ML on iOS within your Expo & React Native App,2024-05-30T16:20:50Z,2023-08-02T08:11:06Z,0
efficient-recorder,https://github.com/janwilmake/efficient-recorder,203,4,Swift,janwilmake,Attempt to create an Open Source Privacy Focused Rewind.ai Alternative for data capture,2025-01-21T20:43:27Z,2025-01-04T13:39:12Z,3
sample-cloudkit-sync-engine,https://github.com/apple/sample-cloudkit-sync-engine,202,15,Swift,apple,,2024-01-12T09:41:13Z,2023-05-11T21:50:49Z,5
rich-editor-swiftui,https://github.com/canopas/rich-editor-swiftui,202,10,Swift,canopas,Powerful WYSIWYG Rich editor for SwiftUI.,2025-01-21T11:31:36Z,2023-10-11T09:01:14Z,2
electroniz3r,https://github.com/r3ggi/electroniz3r,200,12,Swift,r3ggi,Take over macOS Electron apps' TCC permissions,2023-08-12T16:43:30Z,2023-08-12T06:49:41Z,0
iAPS,https://github.com/Artificial-Pancreas/iAPS,199,761,Swift,Artificial-Pancreas,,2025-03-21T18:08:49Z,2023-03-16T09:16:55Z,82
app,https://github.com/ruddarr/app,199,11,Swift,ruddarr,A native iOS companion app for Radarr and Sonarr instances.,2025-03-20T21:46:49Z,2024-01-12T02:37:51Z,28
Firework,https://github.com/Lakr233/Firework,198,7,Swift,Lakr233,烟花箱！,2024-02-08T21:28:58Z,2024-02-07T06:28:52Z,3
AnimacX,https://github.com/AnimacX/AnimacX,198,3,Swift,AnimacX,（弹弹Play MacOS/iOS版）一款可以追番的弹幕视频播放器。原生支持M/intel系列芯片，实现了大部分Window端功能。新增支持iOS系统。,2025-03-21T18:16:48Z,2024-02-26T13:47:49Z,5
ios-swiftui-accessibility-techniques,https://github.com/cvs-health/ios-swiftui-accessibility-techniques,197,18,Swift,cvs-health,Demonstrates iOS SwiftUI Accessibility programming techniques using live good and bad examples that can be tested with VoiceOver and other AT. Includes documentation for developers explaining how to code accessible patterns for iOS.,2025-03-07T19:01:13Z,2023-12-01T20:58:08Z,5
SwiftyCrop,https://github.com/benedom/SwiftyCrop,196,39,Swift,benedom,Crop your images easily using SwiftUI,2025-02-14T03:40:59Z,2023-10-18T13:40:32Z,2
mlem,https://github.com/mlemgroup/mlem,196,32,Swift,mlemgroup,Mlem for Lemmy,2025-03-20T22:33:11Z,2023-07-02T22:10:00Z,213
swift-sdk-generator,https://github.com/swiftlang/swift-sdk-generator,196,16,Swift,swiftlang,Generate Swift SDKs for cross-compilation,2025-03-21T16:56:58Z,2023-02-01T21:07:11Z,22
GenerativeDoodleArt_VisionOS,https://github.com/tracyhenry-visionOS/GenerativeDoodleArt_VisionOS,194,18,Swift,tracyhenry-visionOS,A compact visionOS project that offers a deep dive into the platform's core functionalities,2023-10-04T01:37:45Z,2023-08-09T00:09:33Z,2
swift-translate,https://github.com/hidden-spectrum/swift-translate,194,11,Swift,hidden-spectrum,Swift Package Plugin for automatically translating your String Catalogs,2025-03-18T23:39:46Z,2024-02-12T18:33:55Z,8
elementary,https://github.com/sliemeobn/elementary,194,9,Swift,sliemeobn,"A modern and efficient HTML rendering library - inspired by SwiftUI, built for the web.",2025-02-09T15:27:17Z,2024-06-19T15:43:57Z,2
OpenParsec,https://github.com/hugeBlack/OpenParsec,193,26,Swift,hugeBlack,An open-source Parsec client for iOS/iPadOS. This repo implements mouse & keyboard & touch screen support.,2025-02-15T04:29:50Z,2024-06-02T03:58:21Z,5
approf,https://github.com/moderato-app/approf,193,2,Swift,moderato-app,Play with pprof on macOS,2024-09-26T10:20:11Z,2024-07-28T05:16:24Z,2
teemoji,https://github.com/willswire/teemoji,193,2,Swift,willswire,like tee but with emojis 🍵,2025-03-20T00:07:20Z,2025-01-26T22:04:59Z,3
fcitx5-macos,https://github.com/fcitx-contrib/fcitx5-macos,192,12,Swift,fcitx-contrib,Fcitx5 macOS edition 小企鹅输入法 macOS https://t.me/fcitx5macos qq: 874450150,2025-03-17T00:43:19Z,2023-12-23T17:53:01Z,1
PlaticaBot,https://github.com/migueldeicaza/PlaticaBot,192,16,Swift,migueldeicaza,"MacOS, iOS and watchOS ChatGPT client using your own OpenAI key",2023-07-14T08:38:30Z,2023-03-21T19:48:47Z,7
SFSymbolsMacro,https://github.com/lukepistrol/SFSymbolsMacro,191,3,Swift,lukepistrol,"A Swift Macro for ""type-safe"" SF Symbols.",2025-01-23T18:41:28Z,2023-06-14T13:10:49Z,0
Dream-with-Vision-Pro,https://github.com/Sigil-Wen/Dream-with-Vision-Pro,191,23,Swift,Sigil-Wen,Text to 3D generation in Apple Vision Pro built with the VisionOS SDK. 3D Scribblenauts in AR for the Scale Generative AI Hackathon. Won Scale AI Prize,2023-07-23T01:27:24Z,2023-07-15T19:07:48Z,1
apple-apps,https://github.com/Dashlane/apple-apps,190,21,Swift,Dashlane,🍎 Apple applications sources,2024-11-28T09:27:58Z,2023-01-23T09:35:43Z,1
docc-gpt,https://github.com/gonzalonunez/docc-gpt,190,6,Swift,gonzalonunez,🧹 Self-documenting Swift code with GPT and DocC,2023-06-21T22:42:12Z,2023-03-22T19:52:22Z,2
Whitelist,https://github.com/BomberFish/Whitelist,190,17,Swift,BomberFish,Jailed iOS app to un-blacklist all enterprise-signed apps,2023-04-01T16:40:00Z,2023-02-04T03:30:25Z,0
Breadcrumbs,https://github.com/icanzilb/Breadcrumbs,189,5,Swift,icanzilb,Bugtracker working off source code,2023-10-30T18:45:20Z,2023-10-15T13:33:14Z,1
Harmony,https://github.com/aaronpearce/Harmony,188,14,Swift,aaronpearce,Harmony provides CloudKit sync for GRDB and only GRDB.,2024-10-29T21:56:45Z,2023-06-12T07:41:42Z,6
fal-swift,https://github.com/fal-ai/fal-swift,187,24,Swift,fal-ai,Swift client for the fal.ai model APIs,2024-06-26T06:25:10Z,2023-11-12T03:52:19Z,1
Design-Patterns-in-iOS,https://github.com/KevinTopollaj/Design-Patterns-in-iOS,187,29,Swift,KevinTopollaj,"Welcome to ""Design Patterns in iOS""! This repository is your go-to resource for exploring a wide range of common design patterns in iOS app development. With detailed explanations and practical code examples. I also encourage contributions from the iOS developer community to make this repository a collaborative hub for knowledge sharing.",2024-05-12T13:07:48Z,2023-05-13T19:16:44Z,0
ProgressLine,https://github.com/kattouf/ProgressLine,187,1,Swift,kattouf,⏳Track commands progress in a compact one-line format,2025-01-09T12:31:40Z,2024-07-02T11:43:36Z,1
MacBox,https://github.com/Moonif/MacBox,186,14,Swift,Moonif,MacBox for 86Box,2025-02-10T15:33:01Z,2023-04-11T21:27:11Z,5
RClick,https://github.com/wflixu/RClick,186,17,Swift,wflixu,macos finder  contextmenu,2024-12-23T03:43:06Z,2024-03-13T03:46:17Z,8
Routing,https://github.com/obvios/Routing,185,14,Swift,obvios,Routing library for abstracting navigation logic from SwiftUI views.,2025-03-01T18:16:13Z,2023-12-30T20:51:04Z,1
devtutor,https://github.com/jaywcjlove/devtutor,184,5,Swift,jaywcjlove,DevTutor is an application designed to assist developers in creating exceptional apps using SwiftUI. It offers replicable code samples and corresponding UI previews to streamline your coding process.,2025-01-02T19:13:21Z,2024-04-21T10:46:42Z,3
fellmonger,https://github.com/fbarbat/fellmonger,181,6,Swift,fbarbat,📚 An example of a cross-platform macOS/Windows application developed using Swift 6,2024-09-09T00:52:12Z,2024-06-06T17:32:45Z,0
Azula,https://github.com/Paisseon/Azula,180,17,Swift,Paisseon,"App for injecting dylibs into IPA (iOS 14-16, macOS 11-13)",2024-02-18T23:52:26Z,2023-03-12T20:21:50Z,6
toucan,https://github.com/toucansites/toucan,180,17,Swift,toucansites,Toucan is a static site generator written in Swift.,2025-03-20T20:01:46Z,2023-04-19T17:28:10Z,0
macos-wakatime,https://github.com/wakatime/macos-wakatime,178,26,Swift,wakatime,"Mac system tray app for automatic time tracking and metrics generated from your Xcode, Figma, Postman, etc. usage.",2025-03-05T14:45:36Z,2023-03-06T11:19:22Z,13
injectX,https://github.com/inject-X/injectX,178,23,Swift,inject-X,Simple injection of macOS applications,2025-02-10T09:13:20Z,2024-11-12T15:09:40Z,2
SCIMKiller,https://github.com/xiao99xiao/SCIMKiller,177,4,Swift,xiao99xiao,A painkiller for SCIM issue,2023-12-06T08:59:30Z,2023-08-25T03:36:35Z,0
ShaderGraphCoder,https://github.com/praeclarum/ShaderGraphCoder,177,5,Swift,praeclarum,Write RealityKit shaders using Swift,2024-09-28T16:35:49Z,2024-02-12T20:40:43Z,5
mikotoX,https://github.com/straight-tamago/mikotoX,176,15,Swift,straight-tamago,,2024-09-19T21:45:54Z,2024-09-13T23:59:43Z,8
mergen,https://github.com/sametsazak/mergen,176,10,Swift,sametsazak,"Mergen is an open-source, native macOS application for auditing and checking the security of your MacOS.",2023-05-04T15:22:29Z,2023-04-20T11:47:50Z,9
HandVector,https://github.com/XanderXu/HandVector,175,13,Swift,XanderXu,"Match hand gesture for Apple Vision Pro, Test Hand Tracking on simulator",2024-12-01T03:06:25Z,2023-09-17T13:06:35Z,0
AppIndex,https://github.com/NSAntoine/AppIndex,175,13,Swift,NSAntoine,Analyze & Backup applications on your device,2023-09-11T21:41:16Z,2023-04-03T04:02:31Z,7
draw-things-community,https://github.com/drawthingsai/draw-things-community,174,20,Swift,drawthingsai,The community repository for the Draw Things app.,2025-03-21T05:13:57Z,2023-11-19T21:00:02Z,16
AIProxySwift,https://github.com/lzell/AIProxySwift,173,21,Swift,lzell,Swift client for AI providers. Can make requests straight to the provider or proxied through our API key protection backend,2025-03-20T21:23:53Z,2024-06-11T22:03:40Z,2
SwiftDiffusion,https://github.com/buzsh/SwiftDiffusion,171,6,Swift,buzsh,SwiftUI Stable Diffusion implementation using CoreML and PyTorch,2024-04-17T17:38:24Z,2024-02-03T20:05:45Z,3
swift-openapi-urlsession,https://github.com/apple/swift-openapi-urlsession,170,37,Swift,apple,URLSession transport for Swift OpenAPI Generator.,2025-03-07T14:28:26Z,2023-04-20T16:53:01Z,2
SVDB,https://github.com/Dripfarm/SVDB,170,7,Swift,Dripfarm,"Swift Vector Database. On-device, local vector database for building the next-generation of user experiences",2023-08-07T17:35:26Z,2023-08-04T20:30:08Z,3
swift-for-wasm-examples,https://github.com/apple/swift-for-wasm-examples,169,3,Swift,apple,,2025-03-06T19:10:12Z,2024-02-29T19:03:09Z,0
MuffinStoreJailed-Public,https://github.com/mineek/MuffinStoreJailed-Public,169,58,Swift,mineek,,2025-01-03T11:15:22Z,2024-12-31T14:07:17Z,3
MeshBuddy,https://github.com/insidegui/MeshBuddy,169,9,Swift,insidegui,Simple SwiftUI MeshGradient editor,2024-12-04T12:43:51Z,2024-06-13T18:58:15Z,0
ObfuscateMacro,https://github.com/p-x9/ObfuscateMacro,169,12,Swift,p-x9,🕵️ Swift macros for obfuscation,2024-11-09T16:06:39Z,2023-07-18T05:28:06Z,0
authenticator-ios,https://github.com/bitwarden/authenticator-ios,169,11,Swift,bitwarden,The Bitwarden Authenticator app moved to https://github.com/bitwarden/ios !,2025-03-06T21:55:55Z,2024-03-20T15:59:24Z,1
SwiftUICoordinator,https://github.com/erikdrobne/SwiftUICoordinator,168,8,Swift,erikdrobne,SwiftUICoordinator is a package that seamlessly integrates the Coordinator pattern into the SwiftUI framework.,2025-02-27T20:10:19Z,2023-03-10T12:10:54Z,2
NameDrop,https://github.com/cyrilzakka/NameDrop,167,10,Swift,cyrilzakka,Poor man's replica of iOS 17 NameDrop animation,2023-06-09T16:05:22Z,2023-06-09T15:58:15Z,1
pkl-swift,https://github.com/apple/pkl-swift,166,24,Swift,apple,Pkl bindings for the Swift programming language,2025-02-26T17:12:56Z,2024-01-19T17:28:59Z,7
Noora,https://github.com/tuist/Noora,165,6,Swift,tuist,🎨 A design system for building CLIs in Swift,2025-03-21T09:32:48Z,2023-11-28T12:10:25Z,4
medio,https://github.com/nuance-dev/medio,165,2,Swift,nuance-dev,A minimal free macOS realtime diff checker app,2024-11-28T23:06:01Z,2024-10-23T04:01:24Z,2
DesignPattern,https://github.com/vishalMalvi/DesignPattern,164,19,Swift,vishalMalvi,Design Patterns in Swift,2023-06-04T21:04:48Z,2023-03-07T17:00:01Z,0
SwiftUI-Explorations,https://github.com/tonilijic/SwiftUI-Explorations,164,6,Swift,tonilijic,mono repo for all my SwiftUI explorations ✨,2024-12-19T12:12:53Z,2024-01-16T11:53:27Z,0
frida-ios-playground,https://github.com/NVISOsecurity/frida-ios-playground,163,20,Swift,NVISOsecurity,An iOS app that lets you practice your Frida skills,2023-04-20T09:27:18Z,2023-04-14T09:22:24Z,1
BlurUIKit,https://github.com/TimOliver/BlurUIKit,163,5,Swift,TimOliver,An App Store safe framework for tapping into more of the dynamic blur capabilities of UIKit.,2025-01-21T01:30:56Z,2024-06-16T02:33:22Z,0
space-saver,https://github.com/tranhuycong/space-saver,163,1,Swift,tranhuycong,SpaceSaver is a macOS application designed to help you manage and optimize your workspace. It leverages macOS accessibility features to provide a seamless experience,2025-02-10T02:59:40Z,2024-10-21T08:50:59Z,8
MasonryStack,https://github.com/lukepistrol/MasonryStack,163,6,Swift,lukepistrol,A Pinterest like layout in SwiftUI (horizontal & vertical).,2023-09-16T18:41:50Z,2023-08-25T17:50:26Z,1
swift-container-plugin,https://github.com/apple/swift-container-plugin,162,10,Swift,apple,Swift Package Manager plugin for building container images,2025-03-19T08:52:37Z,2024-09-05T21:04:57Z,7
CoreMLPlayer,https://github.com/npna/CoreMLPlayer,162,11,Swift,npna,Try CoreML models on multiple images and videos easily and quickly,2024-02-11T21:35:18Z,2023-02-04T18:40:06Z,1
OpenAI,https://github.com/FuturraGroup/OpenAI,159,22,Swift,FuturraGroup,A library that makes it easy to use ChatGPT API,2024-02-01T14:41:33Z,2023-02-27T13:39:23Z,0
spectre-kit,https://github.com/patriksvensson/spectre-kit,159,3,Swift,patriksvensson,A Swift framework that makes it easier to create beautiful console applications. ,2024-10-18T11:38:56Z,2023-12-03T17:20:10Z,5
humane.watch,https://github.com/Olivia-li/humane.watch,159,12,Swift,Olivia-li,Humane ai pin on the Apple watch,2023-11-22T22:31:52Z,2023-11-15T05:25:07Z,1
SwiftUI-Navigation-Multiplatform-Example,https://github.com/tunds/SwiftUI-Navigation-Multiplatform-Example,158,6,Swift,tunds,"This repo a 100% SwiftUI app showcasing examples of navigation, Multiplatform support & deep linking using the new NavigationStack & NavigationSplitView API's",2023-04-25T10:43:45Z,2023-04-01T10:06:02Z,0
mcp-swift-sdk,https://github.com/loopwork-ai/mcp-swift-sdk,158,8,Swift,loopwork-ai,Swift SDK for Model Context Protocol servers and clients,2025-03-19T12:42:27Z,2025-02-05T20:50:16Z,2
temperature-swiftui,https://github.com/realvjy/temperature-swiftui,158,16,Swift,realvjy,Simple Temperature Slider using Swift UI,2023-03-28T15:21:44Z,2023-03-25T20:39:47Z,0
BuZhiYin,https://github.com/W-Mai/BuZhiYin,157,7,Swift,W-Mai,不只因,2024-08-19T09:04:32Z,2023-03-12T14:04:53Z,5
web98,https://github.com/nate-parrott/web98,157,7,Swift,nate-parrott,fantasy internet simulator,2024-01-24T20:09:37Z,2023-04-05T04:29:57Z,1
swift-security,https://github.com/dm-zharov/swift-security,157,13,Swift,dm-zharov,"Modern Swift framework for Keychain API. Supports iOS, macOS, watchOS, tvOS and visionOS",2024-09-13T17:37:26Z,2024-01-18T13:05:32Z,1
dns-easy-switcher,https://github.com/glinford/dns-easy-switcher,157,7,Swift,glinford,DNS Easy Switcher (for MacOS),2025-03-16T17:26:09Z,2025-02-23T14:33:01Z,1
mockingstar,https://github.com/Trendyol/mockingstar,156,4,Swift,Trendyol,"Request mocking tool designed to simplify the process of http request mocking, network debugging, and UI tests for your applications.",2025-03-20T06:40:56Z,2023-11-15T11:42:06Z,0
quick-rss,https://github.com/jaywcjlove/quick-rss,156,1,Swift,jaywcjlove,A powerful and intuitive macOS desktop RSS reader that helps you manage and read your favorite RSS feeds with ease.,2025-03-18T15:16:24Z,2024-09-12T17:24:17Z,87
skip-ui,https://github.com/skiptools/skip-ui,156,22,Swift,skiptools,SwiftUI for Android,2025-03-21T19:33:32Z,2023-07-24T00:45:39Z,34
extendedswift,https://github.com/davedelong/extendedswift,156,9,Swift,davedelong,,2025-01-26T16:47:44Z,2023-04-04T21:45:57Z,1
visionOS_2_30Days,https://github.com/satoshi0212/visionOS_2_30Days,155,7,Swift,satoshi0212,visionOS 2 30 days challenge.,2025-02-11T09:50:43Z,2024-07-12T16:32:08Z,0
ContinuityTransition,https://github.com/zurikss/ContinuityTransition,154,9,Swift,zurikss,,2024-03-25T15:38:25Z,2024-03-25T01:47:45Z,0
wishkit-ios,https://github.com/wishkit/wishkit-ios,154,26,Swift,wishkit,In-App Feature Requests. Made Easy.,2024-12-28T06:04:46Z,2023-02-09T03:03:57Z,10
ChuanhuWallpaper,https://github.com/GaiZhenbiao/ChuanhuWallpaper,154,11,Swift,GaiZhenbiao,"A GUI for Wallpapper, generates dynamic wallpapers for macOS",2024-09-17T11:38:14Z,2023-01-13T04:10:27Z,1
yeetd,https://github.com/biscuitehh/yeetd,153,6,Swift,biscuitehh,yeetd is a lil' daemon that watches for specific CPU-intensive Simulator processes and stops them in their tracks!,2023-10-05T12:15:38Z,2023-09-26T02:24:04Z,6
WhatTheErrorCode,https://github.com/AvdLee/WhatTheErrorCode,153,3,Swift,AvdLee,Convert unreadable errors into understandable descriptions,2023-03-22T10:26:33Z,2023-03-16T17:02:04Z,3
swifty-marvel,https://github.com/mohanedy/swifty-marvel,153,11,Swift,mohanedy,A SwiftUI app to showcase my iOS development skills ( Clean Architecture  + MVVM + CoreData + Swinject + Async Await + Unit Testing + Arkana + Mockingbird + CI Pipeline ),2024-06-30T10:35:57Z,2023-07-05T09:35:42Z,0
ScreenShield,https://github.com/JayantBadlani/ScreenShield,152,24,Swift,JayantBadlani,"ScreenShield is an iOS library that provides a simple way to protect your app's content from being captured or recorded by screenshots, screen recordings, or other screen capture methods. It works by adding a secure layer on top of your views, which prevents most screen capture mechanisms from recording the underlying content.",2024-08-05T09:10:48Z,2023-02-23T13:17:47Z,1
did-ca-ios,https://github.com/OmniOneID/did-ca-ios,151,80,Swift,OmniOneID,did-ca-ios,2025-01-13T02:26:20Z,2024-05-23T06:21:20Z,0
SwiftUIFX,https://github.com/finnvoor/SwiftUIFX,151,2,Swift,finnvoor,A Final Cut Pro plugin to render SwiftUI views on your video,2024-11-13T10:41:56Z,2024-11-01T22:26:22Z,5
Antoine,https://github.com/NSAntoine/Antoine,150,8,Swift,NSAntoine,System Log UI for iOS,2024-07-12T11:24:09Z,2023-02-15T20:40:36Z,4
AdaptiveSheet,https://github.com/BenRiceM/AdaptiveSheet,150,2,Swift,BenRiceM,A set of SwiftUI ViewModifiers for presenting adaptive sheets,2025-01-08T14:46:29Z,2024-12-10T16:05:21Z,0
