name,url,stars,forks,language,owner,description,pushed_at,created_at,open_issues
VisionCraft,https://github.com/Sigil-Wen/VisionCraft,150,8,Swift,Sigil-Wen,Minecraft Clone in Apple Vision Pro built with VisionOS SDK,2023-07-09T17:48:30Z,2023-07-01T01:10:58Z,2
ishare,https://github.com/castdrian/ishare,149,10,Swift,castdrian,experience the clean and unbloated screen capture utility for macOS,2025-01-16T15:41:10Z,2023-07-05T07:26:51Z,14
GodotVision,https://github.com/kevinw/GodotVision,149,6,Swift,kevinw,Godot in RealityKit / visionOS,2024-10-28T08:57:55Z,2024-02-04T22:50:14Z,2
SwiftAnthropic,https://github.com/jamesrochabrun/SwiftAnthropic,149,43,Swift,jamesrochabrun,An open-source Swift package for interacting with Anthropic's public API.,2025-03-17T04:36:28Z,2024-01-29T07:43:03Z,1
FridaCodeManager,https://github.com/seanistethered/FridaCodeManager,148,29,Swift,seanistethered,Code/Compile/Install iOS Apps with an App on iOS,2025-02-27T22:40:16Z,2024-03-17T22:59:25Z,0
MainOffender,https://github.com/mattmassicotte/MainOffender,148,4,Swift,mattmassicotte,Utilities for transitioning to Swift Concurrency,2025-01-03T17:45:01Z,2023-07-21T11:09:40Z,0
GoncharKit,https://github.com/gonchar/GoncharKit,148,10,Swift,gonchar,RealityKit helper functions for visionOS,2024-09-15T16:18:31Z,2023-11-10T13:01:57Z,0
FileSwitcherX,https://github.com/straight-tamago/FileSwitcherX,148,8,Swift,straight-tamago,CVE-2022-46689,2023-06-13T08:55:50Z,2023-01-05T21:50:25Z,0
iPadHDMICapture,https://github.com/TomJinW/iPadHDMICapture,146,20,Swift,TomJinW,iPadOS 17 USB Capturing App. 用USB采集卡显示软件，支持播放画面和声音,2023-06-09T02:28:55Z,2023-06-08T21:56:27Z,1
vision-os-workshop,https://github.com/xuchi16/vision-os-workshop,146,11,Swift,xuchi16,A workshop for vision os development.,2024-07-16T16:32:33Z,2023-12-22T08:01:27Z,0
SwiftUI-Macros,https://github.com/Wouter01/SwiftUI-Macros,146,8,Swift,Wouter01,,2024-04-27T02:08:38Z,2023-06-14T03:46:17Z,0
swift-memberwise-init-macro,https://github.com/gohanlon/swift-memberwise-init-macro,145,10,Swift,gohanlon,Swift Macro for enhanced automatic inits.,2025-03-05T20:29:58Z,2023-08-31T20:11:44Z,2
swift-create-xcframework,https://github.com/segment-integrations/swift-create-xcframework,145,17,Swift,segment-integrations,A simple Command Line Tool to create XCFrameworks by wrapping xcodebuild.,2024-07-07T06:12:43Z,2023-08-17T00:19:09Z,0
AI,https://github.com/PreternaturalAI/AI,144,8,Swift,PreternaturalAI,"The definitive, open-source Swift framework for interfacing with generative AI.",2025-02-26T05:05:10Z,2023-09-06T14:07:27Z,1
SwiftXP,https://github.com/bartjakobs/SwiftXP,144,6,Swift,bartjakobs,SwiftUI in style.,2023-01-27T17:16:03Z,2023-01-27T10:53:09Z,0
MenuBarExtraAccess,https://github.com/orchetect/MenuBarExtraAccess,143,8,Swift,orchetect,Show/hide SwiftUI MenuBarExtra menu using Bindings,2025-01-27T22:34:13Z,2023-02-27T12:17:01Z,0
TextChatTranslator,https://github.com/kishikawakatsumi/TextChatTranslator,143,1,Swift,kishikawakatsumi,,2025-01-08T16:11:43Z,2024-06-15T10:16:41Z,0
RatingsKit,https://github.com/Sedlacek-Solutions/RatingsKit,143,6,Swift,Sedlacek-Solutions,SwiftUI library for displaying a ratings request screen,2025-03-14T19:00:14Z,2025-03-10T21:18:31Z,2
Timer,https://github.com/Mijick/Timer,142,2,Swift,Mijick,"Timers Made Simple. The Ultimate Swift Framework with advanced timer management, state control and reactive programming support.",2024-12-19T16:05:10Z,2023-09-21T16:11:04Z,0
MacroKit,https://github.com/IanKeen/MacroKit,143,10,Swift,IanKeen,Exploring Swifts new macro system,2024-07-24T18:26:42Z,2023-06-14T21:31:39Z,0
Modals,https://github.com/newmaterialco/Modals,142,9,Swift,newmaterialco,,2024-04-03T13:29:39Z,2023-08-08T21:33:30Z,1
try-swift-tokyo,https://github.com/tryswift/try-swift-tokyo,141,21,Swift,tryswift,The official app for try! Swift Tokyo 2024,2025-03-18T12:57:16Z,2024-03-02T08:45:43Z,5
Unwatched,https://github.com/fer0n/Unwatched,141,14,Swift,fer0n,"RSS feed based YouTube video player for iOS, macOS, tvOS",2025-03-21T20:42:21Z,2024-01-04T07:00:31Z,6
SoundSeer,https://github.com/jonathangarelick/SoundSeer,140,2,Swift,jonathangarelick,SoundSeer is a macOS app that shows your current song & controls in the menu bar.,2024-05-24T23:03:11Z,2024-04-12T15:22:36Z,8
EditKitPro,https://github.com/aryamansharda/EditKitPro,139,9,Swift,aryamansharda,A multi-purpose Xcode Editor Extension for iOS and macOS developers,2023-09-19T19:26:35Z,2023-01-16T20:17:42Z,0
Scrumdinger,https://github.com/JamesSedlacek/Scrumdinger,139,25,Swift,JamesSedlacek,"A rebuild of Apple’s “Scrumdinger” application using modern, best practices for SwiftUI development.",2025-03-02T00:25:18Z,2025-02-22T03:15:37Z,2
DynamicCowTS,https://github.com/matteozappia/DynamicCowTS,138,6,Swift,matteozappia,Enable Dynamic Island on every device that is running iOS 16.0 - 16.6.1 / 17.0 using TrollStore.,2023-12-11T12:17:29Z,2023-12-05T17:36:36Z,14
UTM-Snapshot-Manager,https://github.com/Metamogul/UTM-Snapshot-Manager,137,10,Swift,Metamogul,A companion app for UTM to manage snapshots for existing virtual machines.,2024-08-31T07:21:24Z,2023-03-10T21:29:05Z,3
Canopy,https://github.com/tact/Canopy,137,5,Swift,tact,A library that helps you isolate CloudKit dependency and write testable code using CloudKit.,2024-11-28T12:21:10Z,2023-03-27T12:12:51Z,0
live-caller-id-lookup-example,https://github.com/apple/live-caller-id-lookup-example,137,14,Swift,apple,Example service & documentation for Live Caller ID Lookup,2025-03-12T14:42:49Z,2024-06-26T05:47:30Z,3
JunoSlider,https://github.com/christianselig/JunoSlider,137,4,Swift,christianselig,A visionOS slider view to mimic Apple's expanding sliders,2024-04-13T22:45:04Z,2024-02-14T16:28:50Z,0
19-Splash-Screen-for-SwiftUI,https://github.com/1998code/19-Splash-Screen-for-SwiftUI,137,7,Swift,1998code,Be the first to try the next-gen SwiftUI Splash Screen. [ AI Assistant available below ],2025-03-19T17:47:31Z,2025-02-10T11:05:26Z,1
AquaUI,https://github.com/jonsterling/AquaUI,136,1,Swift,jonsterling,A library for producing HIG-compliant user interfaces for the Macintosh with Aqua styling,2025-01-26T06:14:59Z,2024-12-29T11:08:52Z,0
SwiftGPT,https://github.com/mbabicz/SwiftGPT,136,23,Swift,mbabicz,iOS app that features a chat powered by ChatGPT and DALL·E 2,2024-04-26T23:38:27Z,2023-02-07T09:53:38Z,2
age-plugin-se,https://github.com/remko/age-plugin-se,136,3,Swift,remko,Age plugin for Apple's Secure Enclave,2025-01-05T08:36:57Z,2023-01-09T17:00:07Z,2
Darock-Bili,https://github.com/Darock-Studio/Darock-Bili,135,12,Swift,Darock-Studio,BiliBili on Apple Watch,2025-03-18T16:07:47Z,2023-07-01T10:34:30Z,50
AppUpdater,https://github.com/s1ntoneli/AppUpdater,135,4,Swift,s1ntoneli,"A simple app-updater for macOS, checks your GitHub releases for a binary asset and silently updates your app.",2024-09-28T00:44:35Z,2024-04-26T09:17:34Z,0
family-drawer,https://github.com/cristicretu/family-drawer,135,9,Swift,cristicretu,Pure SwiftUI Family Drawer recreation!,2025-03-03T19:27:02Z,2025-03-03T06:51:42Z,0
hotwire-native-ios,https://github.com/hotwired/hotwire-native-ios,135,28,Swift,hotwired,Hotwire Native for iOS,2025-03-19T17:08:49Z,2023-12-07T17:40:33Z,14
AssociatedObject,https://github.com/p-x9/AssociatedObject,135,4,Swift,p-x9,🔗 Swift Macro for allowing variable declarations even in class extensions,2024-11-28T09:31:07Z,2023-06-12T02:12:30Z,1
HighlightSwift,https://github.com/appstefan/HighlightSwift,134,22,Swift,appstefan,Code syntax highlighting in Swift and SwiftUI,2024-11-27T17:42:48Z,2023-05-11T15:17:41Z,6
mkprivacy,https://github.com/apparata/mkprivacy,134,6,Swift,apparata,UI tool for creating Apple privacy manifest property lists.,2024-07-31T10:41:58Z,2024-07-22T00:37:19Z,0
SafeDI,https://github.com/dfed/SafeDI,134,6,Swift,dfed,Compile-time-safe dependency injection in Swift,2025-03-12T19:25:55Z,2023-11-23T02:41:03Z,0
KarrotListKit,https://github.com/daangn/KarrotListKit,134,4,Swift,daangn,"KarrotListKit offers a suite of declarative UI APIs for UIKit applications, enabling seamless implementation of data-driven lists.",2025-01-24T08:30:25Z,2024-01-22T08:44:29Z,1
LangSwitch,https://github.com/Nikeev/LangSwitch,134,8,Swift,Nikeev,"LangSwitch - is a super-simple MacOS app that switches your keyboard languages one by one by pressing Fn/🌐 button. No popups, no delay.",2024-09-25T15:13:58Z,2023-07-05T17:36:40Z,10
MachOKit,https://github.com/p-x9/MachOKit,134,11,Swift,p-x9,🔬 A Swift library for parsing mach-o files to obtain various information.,2025-03-21T08:51:13Z,2023-11-28T08:15:31Z,9
OBCalendar,https://github.com/oBilet/OBCalendar,133,3,Swift,oBilet,"OBCalendar is designed for simplicity and customization, it allows you to build beautiful and functional calendar interfaces effortlessly.",2024-12-26T10:58:30Z,2024-09-23T14:19:30Z,0
SettingsAccess,https://github.com/orchetect/SettingsAccess,133,6,Swift,orchetect,Better SwiftUI Settings Scene Access on macOS,2025-01-27T22:38:25Z,2023-09-14T02:31:22Z,0
visionOS-Explorer,https://github.com/castlewong/visionOS-Explorer,133,7,Swift,castlewong,"Explore visionOS: Collection of Code Samples, Tutorials and Valuable Resources",2024-11-06T12:09:36Z,2023-06-05T17:03:32Z,0
achico,https://github.com/nuance-dev/achico,133,5,Swift,nuance-dev,A minimal free macOS local file compressor app,2024-11-20T19:04:07Z,2024-11-01T01:25:39Z,1
Figproxy,https://github.com/ideo/Figproxy,133,7,Swift,ideo,"Software that allows Figma to talk to hardware, enabling the creation of rapid prototypes of physical devices.",2024-05-29T23:43:29Z,2024-04-15T20:07:40Z,4
web-serve,https://github.com/jaywcjlove/web-serve,132,7,Swift,jaywcjlove,Create local network servers effortlessly with a user-friendly interface. Manage multiple servers running simultaneously in the background. Enable mod rewrite for Single Page Applications (SPA) with just one click.,2024-12-03T08:53:10Z,2024-08-27T18:50:37Z,2
AspirinShot,https://github.com/goodwhale/AspirinShot,131,2,Swift,goodwhale,"Painless App Store screenshots with SwiftUI, in Xcode",2025-02-04T10:25:43Z,2023-06-29T21:27:29Z,0
ReerCodable,https://github.com/reers/ReerCodable,131,2,Swift,reers,Codable extensions using Swift Macro,2025-03-05T07:22:32Z,2024-10-15T03:48:03Z,0
ATProtoKit,https://github.com/MasterJ93/ATProtoKit,131,22,Swift,MasterJ93,"A straightforward solution for using AT Protocol and Bluesky, written in Swift.",2025-03-16T15:09:11Z,2024-02-15T17:50:18Z,10
Tuist_Modular_Template,https://github.com/baekteun/Tuist_Modular_Template,130,19,Swift,baekteun,Tuist Modular Architecture Template,2024-11-18T08:57:02Z,2023-01-04T16:02:49Z,2
PagePeelSwipe,https://github.com/Elaidzha1940/PagePeelSwipe,130,16,Swift,Elaidzha1940,⌨️ Page Peel Swipe. Swipe gestures just got a whole lot cooler with this sleek and interactive page curl effect.,2024-04-18T06:00:58Z,2024-04-12T14:42:02Z,0
Canvas,https://github.com/kevinhermawan/Canvas,129,6,Swift,kevinhermawan,DALL·E playground for the Mac,2024-08-05T10:40:38Z,2023-12-25T16:52:37Z,1
swift-winui,https://github.com/thebrowsercompany/swift-winui,129,11,Swift,thebrowsercompany,Swift language bindings for WinUI3 ,2024-12-04T16:18:48Z,2024-02-14T02:06:17Z,0
OpenAITodoList,https://github.com/Archetapp/OpenAITodoList,129,15,Swift,Archetapp,A todo list that uses prompts from a user to create tasks for the day.,2024-04-12T07:20:06Z,2024-01-21T00:52:47Z,0
AIProxyBootstrap,https://github.com/lzell/AIProxyBootstrap,129,9,Swift,lzell,Bootstrap apps to get you started building AI apps with AIProxy,2024-12-30T20:01:47Z,2024-04-28T17:03:17Z,0
Harbor,https://github.com/ohaiibuzzle/Harbor,128,2,Swift,ohaiibuzzle,A harbor for all your game *porting* activities (get it?),2024-01-11T14:45:22Z,2023-06-08T16:28:44Z,0
xHistory,https://github.com/lihaoyun6/xHistory,128,5,Swift,lihaoyun6,A powerful command line history manager built with SwiftUI / 基于SwiftUI构建的命令行历史记录管理工具,2025-01-07T03:32:18Z,2024-11-08T18:12:20Z,1
IsThereNet,https://github.com/FuzzyIdeas/IsThereNet,128,6,Swift,FuzzyIdeas,See when your internet disconnects.. and reconnects,2025-01-14T20:47:47Z,2024-01-03T14:11:04Z,1
PicoAIProxy,https://github.com/PicoMLX/PicoAIProxy,128,9,Swift,PicoMLX,Reverse proxy for OpenAI and Anthropic written in server-side Swift,2025-03-03T01:28:07Z,2023-12-19T07:05:53Z,1
WebExtensionTemplate,https://github.com/kyle-n/WebExtensionTemplate,128,44,Swift,kyle-n,"Create a browser extension for Chrome, Firefox and Safari in no time.",2024-05-21T14:40:36Z,2023-06-27T20:36:43Z,0
dirtycowapp,https://github.com/mineek/dirtycowapp,127,17,Swift,mineek,,2023-01-07T16:18:53Z,2023-01-04T15:28:44Z,2
NetflixVisionPro,https://github.com/barisozgenn/NetflixVisionPro,126,21,Swift,barisozgenn,"Experience the future of entertainment with Vision Pro, an immersive Netflix clone developed for Apple's visionary platform, visionOS. Leveraging the latest SwiftUI advancements and stunning visual effects, this prototype app showcases the possibilities of Vision Pro.",2023-06-26T21:06:54Z,2023-06-22T19:19:25Z,1
craion-onboarding,https://github.com/juanjovn/craion-onboarding,126,8,Swift,juanjovn,Animated onboarding in SwiftUI from my app crAion,2024-06-26T11:13:14Z,2024-06-25T16:29:47Z,0
ObservationBP,https://github.com/onevcat/ObservationBP,126,16,Swift,onevcat,Proof of concept for back-porting Observation framework to earlier iOS versions ,2023-08-09T04:00:15Z,2023-08-03T12:54:53Z,2
Lockra1n_v2.0,https://github.com/alwaysappleftd/Lockra1n_v2.0,125,15,Swift,alwaysappleftd,"A free untethered iCloud bypass app for iOS 15.0 to 16.7.8 (potentially iOS 12/13/14, please test!). Version 2.1 Beta 1 has fixed the iPhone X iOS 16 Mounting issue, adds a Normal mode bypass option, and contains an updated UI. Lockra1n can now bypass untethered via Normal mode (jailbreak) or ramdisk mode.",2024-06-30T10:53:59Z,2023-07-08T08:19:00Z,6
YUI,https://github.com/yihui-hu/YUI,125,8,Swift,yihui-hu,custom view transitions and novel user interfaces in UIKit,2025-01-10T14:37:29Z,2024-12-28T21:11:44Z,0
LearnGo,https://github.com/lixiang0618/LearnGo,125,3,Swift,lixiang0618,"LearnGo, a ios versatile learning tool with RAG and Prompting under LLM like GPT-4o-mini, enabling subject Q&A, smart note generation from uploaded materials, offline photo(or AR) object recognition with translations, and multilingual voice input (Cantonese, English, Mandarin). It also features customizable themes for a personalized experience",2024-11-07T10:05:08Z,2024-10-20T11:59:43Z,0
InjectionNext,https://github.com/johnno1962/InjectionNext,124,5,Swift,johnno1962,Fourth evolution of Code Injection for Xcode,2025-03-21T20:20:19Z,2024-05-30T09:54:05Z,2
Swift3D,https://github.com/andrewzimmer906/Swift3D,124,0,Swift,andrewzimmer906,A SwiftUI like 3D engine backed by Metal,2023-03-13T17:06:59Z,2023-01-19T00:05:37Z,0
swift-retry,https://github.com/fumoboy007/swift-retry,124,1,Swift,fumoboy007,Retries in Swift with sensible defaults and powerful flexibility.,2024-06-05T16:39:38Z,2023-12-10T08:52:45Z,1
mochi,https://github.com/Mochi-Team/mochi,123,19,Swift,Mochi-Team,A free and open-souce content viewer for Apple Devices.,2024-07-04T16:07:35Z,2023-03-24T21:47:13Z,1
embrace-apple-sdk,https://github.com/embrace-io/embrace-apple-sdk,123,17,Swift,embrace-io,Embrace's Swift SDK built on OpenTelemetry,2025-03-21T15:28:56Z,2023-12-18T17:39:14Z,4
XCTestParametrizedMacro,https://github.com/PGSSoft/XCTestParametrizedMacro,123,7,Swift,PGSSoft,Swift macro for parametrizing unit test methods,2023-11-30T11:19:29Z,2023-10-25T09:29:33Z,3
AppClipped,https://github.com/MattHeaney23/AppClipped,123,10,Swift,MattHeaney23,AppClipped is a macOS application designed to improve the generation and saving of App Clip Codes. This app will soon be released as a free-to-download tool to assist projects using App Clip Codes.,2025-03-16T07:51:33Z,2025-03-01T16:48:58Z,1
PokemonCard,https://github.com/helvetiica/PokemonCard,122,5,Swift,helvetiica,3D Pokemon Card using SwiftUI,2024-01-30T06:01:13Z,2024-01-30T05:06:49Z,0
Trio,https://github.com/nightscout/Trio,122,736,Swift,nightscout,Trio - an automated insulin delivery system for iOS based on the OpenAPS algorithm with adaptations.,2025-03-17T19:37:58Z,2024-03-02T15:48:56Z,47
macosrec,https://github.com/xenodium/macosrec,121,3,Swift,xenodium,Take screenshots/videos of macOS windows from the command line,2024-08-26T20:25:14Z,2023-04-13T21:15:47Z,2
react-native-openai,https://github.com/candlefinance/react-native-openai,121,9,Swift,candlefinance,OpenAI API Native bindings for React Native,2024-11-02T14:51:16Z,2023-08-27T16:22:56Z,6
TranslateKit,https://github.com/FlineDev/TranslateKit,121,0,Swift,FlineDev,SF Symbols for Texts: 2000+ built-in translations in 40 languages + semantic localization key macro for Swift devs,2025-02-21T03:26:11Z,2024-11-27T13:53:44Z,0
Aespa,https://github.com/enebin/Aespa,121,19,Swift,enebin,"From camera to album, in just 2 lines",2024-06-03T08:46:13Z,2023-06-01T10:12:44Z,22
Sobre-Public,https://github.com/armandwegnez/Sobre-Public,121,8,Swift,armandwegnez,Repo du projet X du compte de Armand Wegnez (fin JAN.),2025-01-31T11:39:22Z,2025-01-29T16:06:15Z,0
Infinite4Pager,https://github.com/fatbobman/Infinite4Pager,121,4,Swift,fatbobman,"Infinite4Pager is a flexible and powerful SwiftUI component that provides infinite scrolling capabilities in four directions: up, down, left, and right. It's perfect for creating image galleries, card decks, or any other content that requires seamless navigation in multiple directions.",2024-07-17T09:13:42Z,2024-07-08T12:27:52Z,2
ColorTokensKit-Swift,https://github.com/metasidd/ColorTokensKit-Swift,120,3,Swift,metasidd,A powerful color tokens system for Apple platforms,2025-03-04T12:32:40Z,2024-05-04T19:28:27Z,2
Apple-Inspired-Puller,https://github.com/zsergey/Apple-Inspired-Puller,120,4,Swift,zsergey,"Bottom sheet for iOS that I call puller. It has Apple's native API on iOS 11+, works like in Apple Music app and supports interactive pop gesture like in Telegram app. Supports SwiftUI.",2024-08-20T17:13:02Z,2023-03-22T15:29:09Z,2
apple-metal-sketch-dojo,https://github.com/gnikoloff/apple-metal-sketch-dojo,120,5,Swift,gnikoloff,Graphics and animations with the Apple Metal API,2024-10-08T12:09:03Z,2023-01-05T17:19:05Z,1
deepspring-shellmate,https://github.com/srosro/deepspring-shellmate,120,7,Swift,srosro,,2024-12-13T22:25:28Z,2024-05-10T04:36:31Z,15
Ignited,https://github.com/LitRitt/Ignited,120,14,Swift,LitRitt,Ignited is a multi-core emulator front-end for iOS devices. It provides a beautiful user interface and rich features that other emulators lack.,2025-03-06T22:55:17Z,2023-02-17T15:46:31Z,0
HelloMarket,https://github.com/azamsharpschool/HelloMarket,120,16,Swift,azamsharpschool,"HelloMarket is an E-Commerce app that uses SwiftUI, ExpressJS and Postgres database.",2025-02-23T16:06:35Z,2024-10-10T23:07:38Z,0
AppCommander-legacy,https://github.com/BomberFish/AppCommander-legacy,119,9,Swift,BomberFish,A swiss army knife for your iPhone apps. iOS 15.5-16.1.2.,2023-09-30T21:35:46Z,2023-03-17T23:50:44Z,8
