Hash,Date,Author,Message,IsMerge
2afec9e3ed60c63836f10b9ddf0cd1e5480498f1,2021-07-19 20:00:01,Lovell Fuller,Docs: rebuild to include commit 6979042,False
69790421b7a8ff592beb034cd5e15afe984c5c28,2021-07-19 19:55:36,reiv,"Docs: add stats usage note and example (#2803) (#2804)

Clarify that stats are derived from the original input image and that operations need to be buffered in order to obtain stats from the resulting image.",False
3f08f6a35969f6d0c5387dcc40dd143945d132d7,2021-07-19 19:25:22,Lovell Fuller,Add default background metadata for PNG and GIF images,False
719c2db8da235ff52d52edbe37bdab42a29d9f4c,2021-07-15 00:03:24,Lovell Fuller,Bump devDeps,False
a9aa55c32d6a546f2e4b8060bbd69f3b5db470be,2021-07-14 23:52:31,Lovell Fuller,Ensure pipelineColourspace is applied to all inputs #2704,False
3f6d9d6ee925e95c3452906f7617b5fdbcb05624,2021-07-14 18:15:47,Lovell Fuller,Upgrade to libvips v8.11.2-alpha1,False
b32568159ff116659efc73a711549d1e030d386b,2021-07-14 18:15:47,Lovell Fuller,Docs: changelog and credit for #2704,False
bb48d0d857352ac6194e5514165299d04f79e822,2021-07-14 18:15:47,Daiz,Add pipelineColourspace operator,False
536412515f59e251a1d594b651a27505c1f16389,2021-07-14 18:15:47,Lovell Fuller,"Allow installation directory to contain spaces

This previously worked, but regressed in v0.26.0.",False
fcc6eaadd3488cfaa8b628d3e339d87055f1f9a5,2021-07-14 18:15:47,Lovell Fuller,"Tests: reduce WebP CPU time, ~2s faster",False
7dc78e8796e0b8a8a33e6b0504a16e7be18f5330,2021-07-14 18:15:47,Lovell Fuller,Bump deps,False
c65de3fe6d5c31df50fb092bfc3b7c1fed8e52a8,2021-07-14 18:15:47,Lovell Fuller,Default to single-channel output from extractChannel #2658,False
d000f577735c8e5d666ab1ed2440b0636648b03d,2021-07-14 18:15:47,Lovell Fuller,Add compression property to HEIF image metadata #2504,False
75cddbdb6d61fa36f6cc12041eda39ca310178f5,2021-07-14 18:15:47,Lovell Fuller,Default AVIF encoding to 4:4:4 chroma subsampling #2562,False
e418d91511fa88a6b4c014144509efcd8315bcdc,2021-07-14 18:15:47,Lovell Fuller,Test: correct coverage syntax,False
6c2e6c5432544c11504086c5a9d6bfc6dc86df1c,2021-07-14 18:15:47,Lovell Fuller,Install: multiple platform-arch binaries in same tree,False
8c6d9fdc622d3c9c145b23b7b13e4f9bce073332,2021-07-14 18:15:47,Lovell Fuller,Install: always use Brotli-compressed tarballs,False
468e95427e057a59129b98f5aa54895ce87c634b,2021-07-14 18:15:47,Lovell Fuller,CI: migrate ARM64 builds from TravisCI to CircleCI #2665,False
6d7a5ace6b0c910d2ad087dc0db8b786fb47b3a5,2021-07-14 18:15:47,Lovell Fuller,"Drop support for Node.js 10, upgrade to Node-API v5",False
cbaec198a54ea168943dac63191b7b63923535b4,2021-07-14 18:15:47,Lovell Fuller,Upgrade to libvips v8.11.0-rc1,False
7467fa8b50d280780dfa9fe9a7248deaa499c7a1,2021-06-21 21:40:44,Lovell Fuller,"Docs: serve markdown files via Firebase instead of jsdelivr

Might make a few corporate web proxies happier",False
61640fb5c7ed834c264756e224ec81079f8baec2,2021-06-03 23:22:52,Lovell Fuller,CI: use gcc 10 on Linux x64,False
19cb4b62b076887841502b477e32883fbba13376,2021-06-02 13:42:02,Lovell Fuller,Docs: add security-related response headers,False
81ee8bc30f816467d1f5d3ad703c7a9d8cb57b3f,2021-06-02 13:41:08,Lovell Fuller,Docs: make keyword search case insensitive,False
9f384e1c6c111bd98119d567a846c635f9ebbd59,2021-05-24 20:56:34,Lovell Fuller,Release v0.28.3,False
35e8c8b25e824aae8dedbd317fcab536310b8771,2021-05-24 20:54:04,Lovell Fuller,Docs: ensure ops without examples are indexed,False
dc53f1baffdb17b7363a9724934e8259b6cf2f1b,2021-05-24 20:38:10,Lovell Fuller,Bump deps,False
70139600b5713534206b2ba8c6696e6f81ed9306,2021-05-23 23:19:54,Lovell Fuller,Docs: fix CLAHE link,False
1b4d1521e0d7ace47fab304d42f628254aa180df,2021-05-23 23:16:23,Lovell Fuller,Docs: cross-link removeAlpha and flatten,False
ed3377cb2dfe245ae4be05e0c322b4f09a3b9834,2021-05-23 22:32:18,Lovell Fuller,Docs: add parameter names to search keywords,False
d72852b3aae715b9e348ab42e596e729ad9efcc8,2021-05-23 22:15:43,Lovell Fuller,Docs: changelog entry for #2726,False
4b6b6189bf5bd09961cea106150365921d7da6b3,2021-05-23 22:06:04,Brad Parham,Add contrast limiting adaptive histogram equalization (CLAHE) operator (#2726),False
b69a54fc75a21e12caf80fc7d12c1693a8b4b45b,2021-05-17 00:10:43,Lovell Fuller,Ensure presence of libvips before invoking node-gyp,False
81e388a4cc913c7c67a40df08580752a6c2a5e41,2021-05-15 19:22:33,Lovell Fuller,Docs: composite supports failOnError and limitInputPixels,False
5bd5e5052ad53c67c89c930c4eacd1e5fa916280,2021-05-15 18:43:16,Lovell Fuller,Skip shrink-on-load for multi-page WebP #2714,False
a2d3fa729feabfccd44d400ac26e9208b9d2d3c8,2021-05-10 22:29:50,Lovell Fuller,Release v0.28.2,False
cb6811bc47d3cff6e048ec3c47e6f4df8729b77b,2021-05-10 22:14:15,Lovell Fuller,CI: FreeBSD skip notifications,False
53c6e80869cc529e080e793ec741db63620262dc,2021-05-10 20:33:40,Lovell Fuller,Docs: refresh index,False
e71dca586ca0bda52661334dd9d5495068f602e6,2021-05-10 20:33:08,Lovell Fuller,Bump devDeps,False
b3cd48db5fba27c9bb83c9756f8397fca071adbc,2021-05-10 19:11:28,Lovell Fuller,Docs: add section about cross-platform installation,False
476448b9d4b3e29afe7ae6cd3418cb561055e563,2021-05-10 14:25:20,Sebastian,Install: allow cross-libc via sharp-install-force flag (#2692),False
070534df5b67ba21bde8a863eb4b605702ae1f52,2021-05-04 00:18:15,Lovell Fuller,Docs: changelog for #2685,False
9a1e8ed574f7b33ebd673f3c000df79a65c076a8,2021-05-04 00:00:37,Michael Nutt,Add premultiplied boolean flag for raw pixel data input (#2685),False
309918a878240e912b2b8ee62530a4e9b32caf60,2021-05-03 14:34:19,Lovell Fuller,Move lint-related tasks to dedicated script entry,False
cac83b94c1579ba0f15e7e16c98dcd7ed3f4701c,2021-05-03 14:31:43,Lovell Fuller,Bump deps and docs refresh,False
9c06df08a1b35a80b581a50aacc56c3d28f9f4b3,2021-05-03 14:31:17,Lovell Fuller,Docs: changelog entry for #2687,False
52e4543d3116a22c10ad2f62a9824fb782bf5d0a,2021-05-03 13:59:51,Jacob,Detect empty input and throw a helpful error (#2687),False
a688468378a9377be3f3d2620645b471f8cbe0db,2021-05-01 20:54:47,Lovell Fuller,CI: replace Node.js 15 with 16,False
e1760d64fb803cee22517a5b61eda94cdf3cb378,2021-05-01 19:55:57,Lovell Fuller,Tests: updates so latest libvips master branch passes,False
84d4e3cf8fce751485637d28d3873af4cfdd4501,2021-05-01 01:12:46,Lovell Fuller,"Require specific semver functions, aids tree-shaking",False
f8a76372ad85246393099da5f6f263c0d8f0e41a,2021-04-21 18:40:24,Raj Rajhans,Docs: rewrite sentence to avoid grammatical ambiguity (#2668),False
4237f5520f6dfcae2706e6d7ffe3cc3d3e05a604,2021-04-17 18:16:54,Lovell Fuller,Allow withMetadata to set density #967,False
8c0c01c7028a7b6af74568c524f76600a3888c13,2021-04-17 13:41:48,Lovell Fuller,Docs: changelog entry for #2664,False
9c100830e0c2b30b4a417e201cadd4695520c2b7,2021-04-17 13:19:07,msalettes,Allow escaped proxy credentials (#2664),False
ed5d753b89e5649b1586de04ffef6ec903942a64,2021-04-08 01:56:16,Lovell Fuller,Skip shrink-on-load where one dimension <4px #2653,False
d1ca756bd86c0a2a6eaa9e03ab8188d21f088bf5,2021-04-06 21:51:14,Timo Hausmann,Docs: correct flatten example to use object instead of string (#2654),False
16cf9f0ef2013a8da25c8e6b237e5ebf771d22f8,2021-04-05 16:58:16,Lovell Fuller,Release v0.28.1,False
133f69d66c01a5092e314c1619f29455729aeaa8,2021-04-05 16:56:28,Lovell Fuller,Bump prebuild-install (for sharp_local_prebuilds),False
bc60daff9e1fb4a240bac3fa387d468a4fc4a252,2021-04-05 16:09:53,Lovell Fuller,Allow EXIF metadata to be set/update #650,False
43a085d1ae126016bd7c9be74881983554214394,2021-04-02 12:34:21,Lovell Fuller,Add support for OME-TIFF subIFDs #2557,False
8c33d0aa56b840095761a203da904867de11192b,2021-04-02 01:44:06,Lovell Fuller,Allow ensureAlpha to set alpha transparency level #2634,False
fe0767df13a1610390961a10f5d5c1080213c1b1,2021-04-01 20:50:58,Lovell Fuller,Install: log errors with more obvious prefix,False
08a25a0c8fb4dfaa5bddd7d0f4f0eea55cce2f65,2021-04-01 20:34:46,Lovell Fuller,Docs: add animated WebP example #2648,False
cd410080bd62957c46af00ae2e460cd686d9cb7d,2021-03-30 00:46:07,Lovell Fuller,Docs: remove reference to specific Lambda runtime,False
7555378e3b0acca639c6b9fb7bd676b6ebe72714,2021-03-29 18:40:34,Lovell Fuller,Release v0.28.0,False
80c95ee66afd1e3a336e87f345f9b04bc0e21847,2021-03-29 16:46:48,Lovell Fuller,Docs: libvips tarballs are a bit smaller now,False
31563b210d233d1515fab237da811a360e5f0175,2021-03-29 16:46:10,Lovell Fuller,Ensure GIF input will work with future libvips v8.11.0,False
861cd93324eed683052084f6ab01414ced17bae5,2021-03-27 12:41:34,Lovell Fuller,Pre-release v0.28.0-beta1,False
abb344bb1a811f6ef2d5708d54c9b58f3f95fc8d,2021-03-27 03:27:12,Lovell Fuller,Upgrade to libvips v8.10.6,False
6147491d9e003affdc079cf5ea247e4611c29729,2021-03-25 22:04:02,Lovell Fuller,Extend: default missing edge props to zero #2578,False
f1f18fbb4af818df7a1c0b53f2cfe9eacdba0049,2021-03-25 20:08:55,Lovell Fuller,Docs: clarify that flatten removes alpha channel #2601,False
9fc611f25759146ed4d2659a21c3dc74b158a063,2021-03-23 02:00:46,Lovell Fuller,Docs: changelog entries for #2594 #2608,False
34a2e14a144b8768f326751a88c81c0e2d19c59b,2021-03-22 23:57:49,SHG42,"Fix erroneous top/left clipping in composite #2571

Fixes bug where certain input values for top/left parameters
in composite can conflict with clipping logic, resulting in
inaccurate alignment in output.",False
83fe65b9e9b44abf61f0392dad20cc805a67d2da,2021-03-22 02:29:05,Lovell Fuller,Docs: include more relevant content in search index,False
ec26c8aa49ce0026b41a45a443df9289538f46b6,2021-03-22 02:24:09,Lovell Fuller,Docs: ensure toBuffer pixel example works #2624,False
da43a3055fbca5f738bc9f9ab4a5903ac5fefb5d,2021-03-22 02:21:30,Lovell Fuller,Docs: correct typo in description of threshold operation,False
a38126c82ff0668df64d0c6a41784aa8e1d5fd73,2021-03-20 18:54:04,Lovell Fuller,Ensure composite replicates correct tiles with centre gravity #2626,False
cb592ce5888edaa233ad55082c7e780f182dc792,2021-03-19 01:04:56,Lovell Fuller,Tests: add case for SVG with truncated embedded PNG,False
d69c58a6da115dedef905a6a5d2ab9ddb89828df,2021-03-19 01:04:07,Lovell Fuller,Docs: add section about Linux memory allocators,False
bdb1986e08f11366e9ca16ed26fc26de7a073b24,2021-03-18 04:55:34,Lovell Fuller,Tests: run in parallel again,False
55356c78a84b4b0763ccf7d29622605cc4278c36,2021-03-16 01:54:53,Lovell Fuller,Docs: refresh markdown,False
a0f55252b1cc21c5a813e73e7f8e11c8650f81bc,2021-03-16 01:54:13,Lovell Fuller,Tests: a few more speed improvements,False
013f5cffa9f8c5c5aa1a8c6cad4b0d6095441bbf,2021-03-15 23:50:06,Lovell Fuller,"Tests: refactor modulate suite, ~20x faster",False
d5d008f568c59be7ffa711026c1cc859f501b435,2021-03-15 18:37:16,Lovell Fuller,Docs: reorder readme sections,False
3b02134cdc960e2df187d519a51eb1dcf437663b,2021-03-15 02:40:26,Lovell Fuller,Tests: update latest benchmark test results,False
a57d7b51b1152c576ce260f10ff3f7c653e740ad,2021-03-15 01:21:45,Lovell Fuller,Tests: match concurrency with CPU count,False
1a3c38d35fd993184dbc9790cb803d2ae6d7112a,2021-03-14 17:20:33,Lovell Fuller,Pre-release v0.28.0-alpha1,False
00aece0538ad0b8a1b1038df4f0560a8c5437ce6,2021-03-14 16:49:53,Lovell Fuller,Ensure id attr can be set for IIIF tile output #2612,False
5a9cc835b33001c805a0d5fcb05e6d71135cc79d,2021-03-14 16:49:53,Lovell Fuller,"Reduce concurrency when using glibc-based Linux
to help prevent memory fragmentation",False
58526cc8493d3bed3fb8ce65ea694a3c3f605805,2021-03-14 16:49:53,Lovell Fuller,Upgrade to libvips v8.10.6-alpha3,False
955b5f43a565eaba89c352361a398b7bbdce49f2,2021-03-14 16:49:53,Lovell Fuller,Tests: small speed up to a couple of tile-related tests,False
447aec3fdea08def1fe10f1a28ff179786a5676a,2021-03-14 16:49:53,Lovell Fuller,Tests: update leak suppressions,False
473260a8364e1655e8b5ca953fcb319b7b6f832d,2021-03-14 16:49:53,Lovell Fuller,Docs: update with install-time improvements,False
4d2784c10c6ce8191242e0722276eec8f62f372d,2021-03-14 16:49:53,Lovell Fuller,Prebuilt libvips v8.10.6 binaries work with musl 1.1.x and 1.2.x,False
d9af897595dbbdcea560b5fcdbc09c0438d740b4,2021-03-14 16:49:53,Lovell Fuller,"Tests: ensure AVIF order is read, write, read+write",False
23a48be315e111a739abc4c443157509385a2fcb,2021-03-14 16:49:53,Lovell Fuller,"Upgrade to libvips v8.10.6-alpha2

- Prebuilt Linux libvips binaries now use 'new' C++11 ABI",False
ce8f48e5d19079790d525358b82e0999aa74142a,2021-03-14 16:49:53,Lovell Fuller,CI: Add linuxmusl-arm64v8 environment,False
6aaf8396628ada33298a2dbc533868bbd2100b95,2021-03-14 16:49:53,Kleis Auke Wolthuizen,Use a single shared library,False
984a9e653e4105cbb77fdd4cb17a8bbb5afe05eb,2021-03-14 16:49:53,Lovell Fuller,"Upgrade to libvips 8.10.6-alpha1

- Prebuilt binaries now include mozjpeg and libimagequant (BSD 2-Clause)
- Prebuilt binaries limit AVIF support to the most common 8-bit depth
- Add `mozjpeg` option to `jpeg` method, sets mozjpeg defaults
- Reduce the default PNG `compressionLevel` to the more commonly used 6",False
8dffa28b4d19c01cd8d367061f56289920d20cf8,2021-03-14 16:49:53,Lovell Fuller,"Remove npmlog as a direct dependency

It remains a transitive dependency via prebuild-install",False
b05a4bdadd3b90ee05130d47e83aa6785267c44c,2021-03-14 16:49:53,Lovell Fuller,"Use same version of simple-get as prebuild-install
to prevent two different versions being installed",False
36087fe518e479bab99d4dcc8a34f60694dd08c2,2021-03-14 16:49:53,Lovell Fuller,Remove array-flatten dependency,False
5eed87ec4dfbe74372b04cdf065c9f6ba629cf42,2021-03-14 16:49:53,Lovell Fuller,Install: skip header files when using prebuilds,False
af66a7322546fe09fe9731d5a9d902f4b3ffcaa3,2021-03-13 21:48:40,Tobias Nießen,Tests: fix unit test description (#2619),False
dcf913c17ee87ad1f091e1f888a963a2ec5ef889,2021-03-05 20:51:34,Alex Bradley,"Install: fail on incomplete download and clean up tempfile (#2608)

- Fail when the connection closes before the response is complete
- Create tempfile only when needed, and clean it up on failure",False
68ccba8f74191bd06ad64edd615416c638617f3b,2021-02-23 02:47:31,Lovell Fuller,Docs: refresh search index,False
956f7e29db3c8410e68e07fa23d1fd90e80d54df,2021-02-23 02:00:42,Lovell Fuller,Release v0.27.2,False
4264c0577e8a0e74164a768bcd17e26d9593cd59,2021-02-22 19:19:31,Lovell Fuller,"Improve experience for those using Apple M1 devices #2460

- For Rosetta x64, prevent use of global ARM64 libvips
- For ARM64, improve error message when global libvips not found",False
cc37b59309d18cd5461e08e41fca97b04fff7015,2021-02-22 18:02:20,Lovell Fuller,Switch to libvips' recently-exposed has_alpha #2569,False
9f2f92095db8b951da9fa451e697dea2ae22119f,2021-02-21 01:10:40,Lovell Fuller,Skip prebuilt binaries for musl >=1.2.0 #2570,False
0c1075c089b7bc469df1b18768cb0c0f83178916,2021-02-20 21:13:48,Lovell Fuller,Docs: local compilation requires --build-from-source flag,False
9c64710c8b381015470d473b19e2ef1dcc671821,2021-02-20 21:09:25,allx,Allow code bundling of utility functions (#2586),False
f6f16b91db11dd80658c009e90e53855d715e7fa,2021-02-19 22:07:29,Lovell Fuller,Allow use of recomb op with 1/2 channel input #2584,False
1986b5cfe6bd0b7331af6234b70801c97aee85d3,2021-02-19 21:19:21,Lovell Fuller,Bump deps,False
6445b72d410ba670a384e3533377ad6147d634a8,2021-02-19 21:18:59,Lovell Fuller,Docs: Changelog entry and credit for #2581,False
df7b8ba73808fc494be413e88cfb621b6279218c,2021-02-18 02:16:13,Florian Busch,Add support for non lower case extensions with toFormat,False
202083999ed3dc47effdef81bd5c0d1ecfae3da6,2021-02-14 21:27:06,Pedro Poveda,Docs: add closing parenthesis so code example runs,False
315f519e1dd9adca0678e94a5ed0492cb5e0aae4,2021-02-09 02:07:56,aprat84,Docs: correct type for AVIF speed output option (#2568),False
d7d580ae6f9bada7edea941e8f2c0efdc324d793,2021-02-08 18:42:35,Lovell Fuller,Tests: using parallel fails on latest Node.js 15.8.0,False
7017af303d23b6bfa099479b7b3488756880fd24,2021-02-08 17:16:13,Lovell Fuller,Improve error message when attempting toFile/GIF without magick,False
0dc325daa4a5b15bdbd1d6ff2375e0d18b4380c7,2021-01-29 16:59:24,Lovell Fuller,Docs: add section about Webpack configuration,False
6dffb4797383029b38f894317f96d53dff17d25f,2021-01-29 16:58:48,Lovell Fuller,Docs: small search index improvements,False
b19dad69d65dee317ddf164de76d442fdef06a73,2021-01-28 01:14:39,Lovell Fuller,Release v0.27.1,False
94c5ac64e973aa48cfee51fa1289d1e1347e8d56,2021-01-28 01:14:01,Lovell Fuller,Bump devDeps,False
c4bcd088fbc7bb3d0833372df9031cdc7569dbce,2021-01-27 01:57:52,Lovell Fuller,"Tests: run in parallel, ~20% faster on multicore machines",False
aeecbe9396c802fcc248e5c9184acd04c05fa000,2021-01-27 01:57:20,Lovell Fuller,Tests: ensure faster metadata tests pass on ARM64,False
171aade9cd01e1d4e9079485abadaceab51e6da8,2021-01-27 01:22:33,Lovell Fuller,Tests: reduce time taken by metadata tests,False
67213ae86c9b749aec20df19262f45643fd7d02b,2021-01-27 00:13:48,Lovell Fuller,"Tests: refactor output paths, might enable parallel runs",False
24d9e53c3f53a5b2b6e089b5727a8b058984604f,2021-01-26 20:33:43,Lovell Fuller,Docs: add example of 16-bit RGB output #2528,False
573ed5f4b57e4de421f8fc5a1714c86a588f6825,2021-01-26 20:12:08,Kleis Auke Wolthuizen,Avoid calling g_type_from_name #2535,False
ceff628add350e63e69ff588d14a9cac64d390a3,2021-01-26 19:53:56,Bert Verhelst,Docs: ensure correct types for output options,False
0bb8cb9203e134e77cd0e4dc0bb091da6ff63541,2021-01-26 19:30:25,Randy Ridge,Ensure TIFF is cast when using float predictor (#2502),False
98349bde28dfc54ff304a2b47afce35488247637,2021-01-24 22:45:28,Lovell Fuller,Docs: add section on known conflicts,False
f09be932eb192fb1d3fba89c3fb1ae24f6033a7b,2021-01-24 22:22:10,Lovell Fuller,Docs: add info about npm v7 directory ownership change,False
4c57ac2bbe8cbc8afab70a67d92f4cbf4748f153,2021-01-18 22:22:23,Lovell Fuller,Docs: sharp logos are now in the public domain,False
1dd93c1b6b8e1e5b9b23927592be21fd406de31c,2021-01-16 19:56:38,Lovell Fuller,Docs: changelog entry and example for #2527,False
c9f85fe27ffd7f7c818593edd8721d079e74d9fa,2021-01-16 19:33:25,alza54,Expose libvips gaussnoise operation (#2527),False
419cbe50f62609075609b7fac0855869a0773023,2021-01-16 16:23:15,Lovell Fuller,Preserve transparancy in monochrome logo,False
5031c8323fbd9a81a60a9581ab986e89d50a8923,2021-01-16 03:33:00,Lovell Fuller,Add monochrome version of sharp logo,False
762d5913ce14d56bcaa60737535d32dd8668c3f0,2021-01-14 00:02:37,Lovell Fuller,"Avoid nested macro, replace VIPS_AREA w/ reinterpret_cast",False
290df1b1c741e229e398a8112939eb97b49da55d,2021-01-13 23:39:42,Lovell Fuller,Windows: fix preprocessor syntax,False
79170afc51e339febdc1359dcc5098449b5bfe03,2021-01-13 23:36:28,Lovell Fuller,Docs: add 2021 as a copyright year,False
bba00c2bfe1ed3aeb04c63c4193b7fc7e6bb6f47,2021-01-13 23:20:58,Lovell Fuller,Revert: ensure all platforms use fontconfig #2399 #2515,False
f7e2b3688feb43d2057e16658f41dcd44d287f44,2021-01-13 22:53:29,Lovell Fuller,Bump devDependencies,False
8d49b7dde10684ea7af3c46984b9bf4d94ea10b8,2021-01-13 22:17:49,Lovell Fuller,"Ensure tests pass with latest libvips master branch

Expose forthcoming HEIF features where available",False
138e60adb3ff260fcbc6a127a47bffc3073839e0,2021-01-06 19:09:47,Lovell Fuller,Docs: add section for Apple M1 users #2460,False
d6376c31e0522e3313a475c3def7c4f96141ef2b,2021-01-06 18:42:24,Lovell Fuller,Test: ensure toBuffer tests return any errors,False
a7003e93c881ef97aa1191e3a888b1d8be23c4a1,2021-01-06 16:40:11,Lovell Fuller,Docs: changelog entry for #2511,False
4821a112239d4ccfeb7f0e8ff568b0dfd248914d,2021-01-06 15:19:24,Leon Radley,Add support for Uint8(Clamped)Array input (#2511),False
bf1b326988ac7af759e044a483136d145ea7a74e,2021-01-01 20:49:35,Lovell Fuller,Docs: allow docs to be built on Windows,False
39ddb6a175ad3d267b92e2314941a9abeeeb4418,2021-01-01 20:17:26,Lovell Fuller,Docs: improve descripion of create/raw props,False
b2a0b8c0f0762ed1c8689b6b29d226ced655a002,2020-12-22 17:20:23,Lovell Fuller,Release v0.27.0,False
4debc46d0e026e94c8c6581eb0824a4ae8e524bf,2020-12-22 17:17:54,Lovell Fuller,Docs: add AVIF to supported formats,False
f4e259d10f73df021b5b8d93072b2db87e6797da,2020-12-22 02:44:15,Lovell Fuller,Pre-release v0.27.0-beta1 (prebuild test),False
774d78228e25a954ae3e17634cfdca237d9bf80c,2020-12-22 02:30:44,Lovell Fuller,Docs: update performance test results,False
0e62bde5c3502b46f15cf40949012b19227e373d,2020-12-22 01:56:57,Lovell Fuller,Update (and pin) benchmark module versions,False
2bbd9b23e6b40830813264c76812b569c86cad19,2020-12-21 16:54:34,Lovell Fuller,"Add new leak test suppressions (fontconfig, gsf, rsvg)",False
02676140e8c0c86471548a98c49389876abb9ff2,2020-12-20 23:06:39,Manan Jadhav,"Allow for negative top/left offsets in composite overlays

A top or left offset value of -1 will no longer mean that the
value is not set, but will now be an actual offset of -1.

INT_MIN for left & top will mean that the values are not set.

Co-authored-by: Christian Flintrup <chr@gigahost.dk>",False
182beaa4a1cecacef5a74402184020c1017d0d76,2020-12-20 22:47:49,Lovell Fuller,Docs: add note about AVIF images smaller than 16x16,False
7c08a09529828a07c5a5b0b2a518d3dda1a0d828,2020-12-20 22:35:37,Lovell Fuller,"Add new leak test suppressions (rsvg, vips, heif, aom)",False
ef964b547237a537b5a5251edc6856ac01f2492e,2020-12-20 15:53:26,Lovell Fuller,Ensure all platforms use fontconfig to render #2399,False
ee54ce99135b7ba5ea4a3ebd16f2c0f1fd23e403,2020-12-20 15:21:33,Lovell Fuller,Upgrade to stable libvips v8.10.5 prebuild,False
e59e14688707215233bfb11e46cb9b58b2705d04,2020-12-18 23:09:11,Lovell Fuller,"CI: migrate x64 Linux, macOS and Windows to GitHub Actions",False
103ec0d58f1c6a940a617a156e4d9f3cd832233a,2020-12-18 23:02:16,Lovell Fuller,"Upgrade to libvips 8.10.5, AVIF support in prebuilt binaries

Remove experimental status from HEIF, changing defaults
to prefer royalty-free AV1 over patent-encumbered HEVC",False
a0d89ed514c761593faac145e6fc1b1aad4f0990,2020-12-09 20:31:14,Lovell Fuller,Add link to documentation on new issue page,False
c10888e6fe38885e2a21ee9598b941001920fd22,2020-11-16 22:14:18,Lovell Fuller,Release v0.26.3,False
93455f8eb51d3356262c4c9e846b4f4e29bc830f,2020-11-16 20:56:27,Lovell Fuller,Docs: changelog entry for #2412,False
65acd96c8dd09fe5ee76a66fc1a1d84de110ba52,2020-11-16 20:52:13,Matt Kane,Install: conditionally use Brotli or gzip prebuilt libvips (#2412),False
fabe720b9bea96974a96986f4b6e44e0d0c82cb3,2020-11-16 20:40:28,Lovell Fuller,Docs: keyword search improvements,False
53dd313e97496ecc1f1ebeaaf5ccde6fc465fc3a,2020-11-16 19:25:55,Lovell Fuller,"CI: force build from source, req of prebuild-install v6+",False
2678d7a66076008561f0553c70901f2cc3273bb8,2020-11-16 18:22:03,Lovell Fuller,Bump dev dependencies,False
46718102c6f6abd4abda1a2dc67b8067759e611b,2020-11-16 18:05:19,Lovell Fuller,Docs: changelog for #2336,False
0f473fe3b12c38102a0a133aa192f53f24285913,2020-11-16 17:57:38,Guillermo Varela,Expose libvips affine operation (#2336),False
2872602c9e000ca821a0aef48597d0367991f4a8,2020-11-16 17:52:35,Nick Jones,Deps: upgrade to prebuild-install 6.0.0 (#2419),False
ab653cae3315889b39d4eece74c9ba2ae0a23f55,2020-11-16 17:50:29,Lovell Fuller,"Docs: use of N-API removes Electron-specific binaries

Clarify Lambda deployment for Windows/macOS users",False
e6a035e57571ff4261fac00c9ddd014773792ab3,2020-10-23 14:31:29,Nicolas Stepien,CI: add Node.js 15 (#2415),False
fbe48d75ddf5c1148d4f6006c5269b20155a73ae,2020-10-14 22:29:55,Lovell Fuller,Release v0.26.2,False
20ba0f49dd41352c47cb50f2650478cbe22bb9e0,2020-10-08 14:35:39,Lovell Fuller,Changelog entry and doc refresh for #2397,False
c213e9878d3d6335ebbff3f6811fb5ea5b77b7b3,2020-10-08 14:21:54,beig,Add centre/center option to tile-based output (#2397),False
9704ca4c18f9d984594fee2ebba2488a357d4993,2020-10-07 19:42:06,Lovell Fuller,Add support for libvips compiled with OpenEXR #698,False
49dce6219e5b4a3d50b7523a931e1b632924c983,2020-10-07 19:13:13,Lovell Fuller,Docs: changelog entry for #2379,False
260ff6c94f17838b84f392dea2f751b50dd76810,2020-10-06 21:38:32,Adam Coster,Docs: clarify response object description for trim (#2400),False
3ec281d1041d4b6ac76d363a81ab1cacd79fb869,2020-09-24 02:11:14,Adam Lovatt,Ensure support for yarn v2 (#2379),False
c4c43d525bbf22f0b7700f539bfcfdcb33999037,2020-09-20 13:59:50,Lovell Fuller,Release v0.26.1,False
6c5cde363a15ae5d316c8456fcc8eede3798b7a6,2020-09-20 01:23:15,Lovell Fuller,Ensure animated GIF output is optimised #2376,False
d46b4d950f83c2ebbdc4cccdded55823f1d15598,2020-09-19 18:56:30,Lovell Fuller,"Allow spaces in installation directory #2279
Uses new include_dir property of node-addon-api",False
b369c4bb8a52db0072b46cffd974d4964ff12860,2020-09-17 15:38:52,Lovell Fuller,Ensure stats can be calculated for 1x1 input #2372,False
c3898487c4705ca20788523cea151b9467b32426,2020-09-17 15:32:16,Lovell Fuller,CI: name the FreeBSD task,False
ca3c5b400f78c03276cb4782be0bf51ddedfe395,2020-09-15 23:51:32,Lovell Fuller,"CI: install ARM64 nodejs package with dependency on python3-minimal

Node.js 14 will work but 10 and 12 will fail until
https://github.com/nodesource/distributions/issues/1100 is fixed",False
97772b176c95fd88925a0f1e38b7b8059734de89,2020-09-15 22:35:22,Lovell Fuller,Docs: changelog entry for #2369,False
08a2965f1c5f9e4e92e406167b34f59068d50514,2020-09-15 19:42:26,AcrylicShrimp,Ensure animation-related properties work with stream-based input,False
76dcddfa3d6042b6a23239cf0e139ce93bf53ab5,2020-09-02 13:36:15,Lovell Fuller,"Changelog, credit, doc update for #2348",False
79f476ae4d10bbaf956d915e015be8873a9e8f17,2020-09-02 13:26:12,stefanprobst,Allow input density range up to 100000 DPI (#2348),False
